[
  {
    "command": "git",
    "category": "開発・エディタ",
    "summary_ja": "ソースコードの履歴管理を行う分散型バージョン管理システム",
    "description_ja": "コードの変更履歴を記録し、複数人での共同開発や過去の状態への巻き戻し、ブランチを用いた並行開発を行うための業界標準ツールです。",
    "syntax": "git <サブコマンド> [オプション] [引数]",
    "options": [
      { "flag": "status", "desc_ja": "作業ツリーとステージングエリアの状態を確認" },
      { "flag": "add <パス>", "desc_ja": "変更をステージングエリア（コミット対象）に追加" },
      { "flag": "commit -m '<メッセージ>'", "desc_ja": "ステージされた変更を記録" },
      { "flag": "push", "desc_ja": "ローカルのコミットをリモートリポジトリへ送信" },
      { "flag": "pull", "desc_ja": "リモートの最新コミットを取得して作業ブランチに統合" }
    ],
    "examples": [
      { "description_ja": "変更状態を1行グラフ形式で分かりやすく確認する", "command": "git log --oneline --graph" },
      { "description_ja": "特定ファイルの変更差分を確認する", "command": "git diff <ファイル名>" },
      { "description_ja": "新規ブランチを作成して即座に切り替える", "command": "git checkout -b feature/new-login" }
    ]
  },
  {
    "command": "curl",
    "category": "ネットワーク・通信",
    "summary_ja": "URLを指定してサーバーとデータ送受信を行うコマンドラインHTTPツール",
    "description_ja": "APIエンドポイントの疎通確認、ヘッダー情報の検査、ファイルのダウンロード、POSTリクエスト送信などをターミナルから直接実行できます。",
    "syntax": "curl [オプション] <URL>",
    "options": [
      { "flag": "-I, --head", "desc_ja": "レスポンスヘッダーのみを取得して表示" },
      { "flag": "-s, --silent", "desc_ja": "進行状況やエラーメーターを非表示にする（スクリプト向け）" },
      { "flag": "-X <メソッド>", "desc_ja": "HTTPリクエストメソッド（GET, POST, PUT等）を指定" },
      { "flag": "-H '<ヘッダー>'", "desc_ja": "カスタムHTTPヘッダーを指定" },
      { "flag": "-d '<データ>'", "desc_ja": "HTTP POSTリクエストの本文データを送信" }
    ],
    "examples": [
      { "description_ja": "Webサーバーのステータスコードとレスポンスヘッダーを確認する", "command": "curl -I https://httpbin.org/get" },
      { "description_ja": "JSONデータをPOST送信する", "command": "curl -X POST https://httpbin.org/post -H 'Content-Type: application/json' -d '{\"user\":\"ouki\"}'" },
      { "description_ja": "リダイレクトを自動追跡してファイルとして保存する", "command": "curl -L -o download.tar.gz https://example.com/archive.tar.gz" }
    ]
  },
  {
    "command": "wget",
    "category": "ネットワーク・通信",
    "summary_ja": "バックグラウンド実行や再帰ダウンロードに対応したファイルダウンローダー",
    "description_ja": "HTTP/HTTPS/FTP経由でファイルを確実に取得します。回線切断時の自動リトライやレジューム（中断再開）機能が強力です。",
    "syntax": "wget [オプション] <URL>",
    "options": [
      { "flag": "-c, --continue", "desc_ja": "部分的にダウンロードされたファイルの続きから再開" },
      { "flag": "-O <ファイル名>", "desc_ja": "保存先のファイル名を指定" },
      { "flag": "-b, --background", "desc_ja": "バックグラウンドでダウンロードを実行" },
      { "flag": "-q, --quiet", "desc_ja": "進捗ログを出力しない静寂モード" }
    ],
    "examples": [
      { "description_ja": "大容量ファイルを別名で保存する", "command": "wget -O setup.tar.gz https://example.com/large-file.tar.gz" },
      { "description_ja": "中断したダウンロードを再開する", "command": "wget -c https://example.com/large-file.tar.gz" }
    ]
  },
  {
    "command": "zsh",
    "category": "開発・エディタ",
    "summary_ja": "強力なコマンド補完と拡張性を誇る高機能対話型シェル",
    "description_ja": "Bashの上位互換として開発され、強力なパス補完、プラグイン機構、テーマ機能、スペル修正、共有コマンド履歴などを提供します。",
    "syntax": "zsh [オプション] [スクリプトファイル]",
    "options": [
      { "flag": "-c <コマンド>", "desc_ja": "指定した文字列をコマンドとして実行して終了" },
      { "flag": "-i", "desc_ja": "対話型シェルとして起動" }
    ],
    "examples": [
      { "description_ja": "設定ファイルを再読み込みして最新の設定を反映する", "command": "source ~/.zshrc" },
      { "description_ja": "デフォルトシェルをZshに変更する", "command": "chsh -s $(which zsh)" }
    ]
  },
  {
    "command": "tmux",
    "category": "開発・エディタ",
    "summary_ja": "SSH切断後もプロセスを維持できるターミナルマルチプレクサ",
    "description_ja": "1つの端末ウィンドウ内で複数の仮想画面（ペイン）を縦横に分割したり、セッションをバックグラウンドに保持（デタッチ/アタッチ）できます。",
    "syntax": "tmux [サブコマンド] [オプション]",
    "options": [
      { "flag": "new -s <セッション名>", "desc_ja": "名前付きの新規セッションを作成して開始" },
      { "flag": "attach -t <セッション名>", "desc_ja": "既存のセッションに再接続（アタッチ）" },
      { "flag": "ls", "desc_ja": "実行中のセッション一覧を表示" },
      { "flag": "kill-session -t <名>", "desc_ja": "指定したセッションを終了" }
    ],
    "examples": [
      { "description_ja": "新規セッション 'work' を立ち上げる", "command": "tmux new -s work" },
      { "description_ja": "デタッチ（セッションを維持したまま抜ける）", "command": "Ctrl+b を押した後に d" },
      { "description_ja": "既存の 'work' セッションに復帰する", "command": "tmux attach -t work" }
    ]
  },
  {
    "command": "vim",
    "category": "開発・エディタ",
    "summary_ja": "モーダル編集（ノーマル/挿入/コマンド）を採用した高機能CLIエディタ",
    "description_ja": "GUIのないサーバー環境でも高速かつ効率的にファイルを編集できる、Linux標準の定番テキストエディタです。",
    "syntax": "vim [オプション] <ファイルパス>",
    "options": [
      { "flag": "-R", "desc_ja": "読み取り専用（ReadOnly）モードで開く" },
      { "flag": "+<行番号>", "desc_ja": "指定した行番号にカーソルを置いた状態で開く" }
    ],
    "examples": [
      { "description_ja": "ファイルを編集する", "command": "vim config.yaml" },
      { "description_ja": "保存して終了する", "command": ":wq (ノーマルモード時)" },
      { "description_ja": "保存せずに強制終了する", "command": ":q! (ノーマルモード時)" }
    ]
  },
  {
    "command": "tree",
    "category": "ファイル操作・圧縮",
    "summary_ja": "ディレクトリとファイルの階層構造を視覚的なツリー図で表示するツール",
    "description_ja": "プロジェクトの構成を把握したいときや、ドキュメント・README用にディレクトリ図を生成したいときに重宝します。",
    "syntax": "tree [オプション] [ディレクトリパス]",
    "options": [
      { "flag": "-L <深さ>", "desc_ja": "表示する階層の最大深度を制限（例: -L 2）" },
      { "flag": "-a", "desc_ja": "ドット（.）で始まる隠しファイルも含めてすべて表示" },
      { "flag": "-d", "desc_ja": "ファイルを除外し、ディレクトリのみをツリー表示" },
      { "flag": "-I '<パターン>'", "desc_ja": "指定したパターン（node_modules等）を除外" }
    ],
    "examples": [
      { "description_ja": "深さ2階層までディレクトリ構造を表示する", "command": "tree -L 2" },
      { "description_ja": "node_modulesとgitディレクトリを除外して表示する", "command": "tree -I 'node_modules|.git'" }
    ]
  },
  {
    "command": "jq",
    "category": "システム監視・プロセス",
    "summary_ja": "コマンドライン上でJSONデータを整形・抽出・変換する軽量プロセッサ",
    "description_ja": "curlで取得したAPIレスポンスの色付け整形、特定キーの値の取り出し、配列のループ処理、マッピングなどを強力にサポートします。",
    "syntax": "jq [オプション] '<フィルター式>' [ファイルまたは標準入力]",
    "options": [
      { "flag": ".", "desc_ja": "JSON全体をインデント付きカラー表示で整形（プリティプリント）" },
      { "flag": "-r, --raw-output", "desc_ja": "文字列の前後のダブルクォートを取り除いてプレーンテキスト出力" },
      { "flag": "-c, --compact-output", "desc_ja": "改行をなくし、1行のコンパクトなJSONとして出力" }
    ],
    "examples": [
      { "description_ja": "curlのJSONレスポンスを見やすく整形する", "command": "curl -s https://httpbin.org/get | jq ." },
      { "description_ja": "JSONから特定プロパティの値のみを取り出す", "command": "cat package.json | jq -r '.version'" },
      { "description_ja": "配列要素の特定フィールドをリストアップする", "command": "cat data.json | jq '.[].name'" }
    ]
  },
  {
    "command": "htop",
    "category": "システム監視・プロセス",
    "summary_ja": "CPU・メモリ・スワップおよびプロセスを視覚的に監視・操作する対話型モニター",
    "description_ja": "標準のtopコマンドより格段に見やすく、CPU各コアの使用率やメモリ消費、プロセスのツリー表示、F9キーでのシグナル送信（Kill）が可能です。",
    "syntax": "htop [オプション]",
    "options": [
      { "flag": "-d <ミリ秒/10>", "desc_ja": "画面の更新インターバルを指定" },
      { "flag": "-u <ユーザー名>", "desc_ja": "指定したユーザーのプロセスのみをフィルタリング表示" }
    ],
    "examples": [
      { "description_ja": "インタラクティブモニターを起動する", "command": "htop" },
      { "description_ja": "rootユーザーのプロセスのみを監視する", "command": "htop -u root" }
    ]
  },
  {
    "command": "unzip",
    "category": "ファイル操作・圧縮",
    "summary_ja": "ZIP形式で圧縮されたアーカイブファイルを展開・閲覧するユーティリティ",
    "description_ja": "Windows等で作成された.zipファイルをLinux環境で解凍したり、解凍前に中身のファイルリストを確認できます。",
    "syntax": "unzip [オプション] <zipファイル> [-d 出力先ディレクトリ]",
    "options": [
      { "flag": "-l", "desc_ja": "展開せずにZIPファイル内の一覧を表示（リストモード）" },
      { "flag": "-d <パス>", "desc_ja": "展開先のディレクトリを指定（自動作成される）" },
      { "flag": "-q", "desc_ja": "展開時のファイル名出力を抑制する静寂モード" },
      { "flag": "-o", "desc_ja": "既存ファイルがある場合に警告なしで上書き" }
    ],
    "examples": [
      { "description_ja": "ZIPファイルを特定ディレクトリに展開する", "command": "unzip archive.zip -d ./extracted_folder" },
      { "description_ja": "解凍せずに中身のファイル構成を確認する", "command": "unzip -l archive.zip" }
    ]
  },
  {
    "command": "tar",
    "category": "ファイル操作・圧縮",
    "summary_ja": "複数ファイルのアーカイブ化およびgzip/bzip2/xzによる圧縮・解凍ツール",
    "description_ja": "Linux環境におけるバックアップや配布ファイルのデファクトスタンダードです。.tar.gz や .tar.xz などの作成と展開を担います。",
    "syntax": "tar [オプション] [アーカイブファイル名] [対象パス]",
    "options": [
      { "flag": "-c", "desc_ja": "新規アーカイブファイルを作成 (create)" },
      { "flag": "-x", "desc_ja": "アーカイブファイルを展開・解凍 (extract)" },
      { "flag": "-z", "desc_ja": "gzipアルゴリズムで圧縮/解凍 (.tar.gz)" },
      { "flag": "-v", "desc_ja": "処理中のファイル名を詳細に画面表示 (verbose)" },
      { "flag": "-f <ファイル名>", "desc_ja": "操作対象のアーカイブファイル名を指定" },
      { "flag": "-C <パス>", "desc_ja": "展開先ディレクトリを指定して移動" }
    ],
    "examples": [
      { "description_ja": "フォルダを .tar.gz 形式で圧縮する", "command": "tar -czvf my_backup.tar.gz ./my_project" },
      { "description_ja": "圧縮アーカイブを現在のディレクトリに解凍する", "command": "tar -xzvf my_backup.tar.gz" },
      { "description_ja": "解凍せずにアーカイブ内の一覧を確認する", "command": "tar -tzvf my_backup.tar.gz" }
    ]
  },
  {
    "command": "w3m",
    "category": "ネットワーク・通信",
    "summary_ja": "ターミナル上で動作する高速なテキストWebブラウザおよびHTMLページャー",
    "description_ja": "C言語製でミリ秒単位で起動します。HTMLテーブルの罫線表示、ハイパーリンク、整形レンダリングに対応しており、APIレスポンスのプレビューにも最適です。",
    "syntax": "w3m [オプション] [URLまたはHTMLファイル]",
    "options": [
      { "flag": "-dump", "desc_ja": "対話画面を開かず、標準出力に整形されたプレーンテキストを一括出力" },
      { "flag": "-T <MIMEタイプ>", "desc_ja": "ドキュメントタイプを明示指定（例: -T text/html）" },
      { "flag": "-cols <列数>", "desc_ja": "出力する行の折り返し文字幅を指定" }
    ],
    "examples": [
      { "description_ja": "HTMLファイルをターミナルに美しく整形して表示する", "command": "w3m -dump page.html" },
      { "description_ja": "curlのレスポンスHTMLをパイプで即時プレビューする", "command": "curl -s https://example.com | w3m -dump -T text/html" }
    ]
  },
  {
    "command": "req",
    "category": "自作開発ツール",
    "summary_ja": "SQLite履歴・変数・HTMLプレビュー対応の対話型CLI HTTPクライアント",
    "description_ja": "curlのパラメータ指定の煩わしさを解消するウィザード形式のHTTPテストツールです。プロジェクト変数({{baseUrl}})、クエリパラメータ個別編集、レスポンスのw3m整形、直前リクエストのワンタッチ再送をサポートします。",
    "syntax": "req [または http-cli]",
    "options": [
      { "flag": "(対話型)", "desc_ja": "数字キー（1-9）や 'b'（戻る）によるエンターキー不要の即時操作" },
      { "flag": "{{var}}", "desc_ja": "プロジェクト変数（baseUrl, apiKey, token等）の自動置換" }
    ],
    "examples": [
      { "description_ja": "対話型ウィザードを起動して新規リクエストを作成・送信する", "command": "req" },